[
{"domain_name": "facebook.com", "registered_on": "1997-03-29", "expires_on": "2032-03-30", "updated_on": "2023-04-26", "status": ["clientDeleteProhibited", "clientTransferProhibited", "clientUpdateProhibited", "serverDeleteProhibited", "serverTransferProhibited", "serverUpdateProhibited"], "servers_names": ["a.ns.facebook.com", "b.ns.facebook.com", "c.ns.facebook.com", "d.ns.facebook.com"], "registrant_name": "Domain Admin", "registrant_organization": "Meta Platforms, Inc.", "registrant_street": "1601 Willow Rd", "registrant_city": "Menlo Park", "registrant_state": "CA", "registrant_postal_code": "94025", "registrant_country": "US", "registrant_phone": "+1.6505434800", "admin_name": "Domain Admin", "admin_organization": "Meta Platforms, Inc.", "admin_street": "1601 Willow Rd", "admin_city": "Menlo Park", "admin_state": "CA", "admin_postal_code": "94025", "admin_country": "US", "admin_phone": "+1.6505434800", "tech_name": "Domain Admin", "tech_organization": "Meta Platforms, Inc.", "tech_street": "1601 Willow Rd", "tech_city": "Menlo Park", "tech_state": "CA", "tech_postal_code": "94025", "tech_country": "US", "tech_phone": "+1.6505434800", "raw_data": "Domain Name: FACEBOOK.COM Registry Domain ID: 2320948_DOMAIN_COM-VRSN Registrar WHOIS Server: whois.registrarsafe.com Registrar URL: https://www.registrarsafe.com Updated Date: 2023-04-26T19:04:19Z Creation Date: 1997-03-29T05:00:00Z Registrar Registration Expiration Date: 2032-03-30T04:00:00Z Registrar: RegistrarSafe, LLC Registrar IANA ID: 3237 Registrar Abuse Contact Email:  @registrarsafe.com Registrar Abuse Contact Phone: +1.6503087004 Domain Status: clientDeleteProhibited https://www.icann.org/epp#clientDeleteProhibited Domain Status: clientTransferProhibited https://www.icann.org/epp#clientTransferProhibited Domain Status: clientUpdateProhibited https://www.icann.org/epp#clientUpdateProhibited Domain Status: serverDeleteProhibited https://www.icann.org/epp#serverDeleteProhibited Domain Status: serverTransferProhibited https://www.icann.org/epp#serverTransferProhibited Domain Status: serverUpdateProhibited https://www.icann.org/epp#serverUpdateProhibited Registry Registrant ID:  Registrant Name: Domain Admin Registrant Organization: Meta Platforms, Inc. Registrant Street: 1601 Willow Rd  Registrant City: Menlo Park Registrant State/Province: CA Registrant Postal Code: 94025 Registrant Country: US Registrant Phone: +1.6505434800 Registrant Phone Ext: Registrant Fax:  Registrant Fax Ext: Registrant Email:  @fb.com Registry Admin ID:  Admin Name: Domain Admin Admin Organization: Meta Platforms, Inc. Admin Street: 1601 Willow Rd  Admin City: Menlo Park Admin State/Province: CA Admin Postal Code: 94025 Admin Country: US Admin Phone: +1.6505434800 Admin Phone Ext: Admin Fax:  Admin Fax Ext: Admin Email:  @fb.com Registry Tech ID:  Tech Name: Domain Admin Tech Organization: Meta Platforms, Inc. Tech Street: 1601 Willow Rd  Tech City: Menlo Park Tech State/Province: CA Tech Postal Code: 94025 Tech Country: US Tech Phone: +1.6505434800 Tech Phone Ext: Tech Fax:  Tech Fax Ext: Tech Email:  @fb.com Name Server: D.NS.FACEBOOK.COM Name Server: A.NS.FACEBOOK.COM Name Server: B.NS.FACEBOOK.COM Name Server: C.NS.FACEBOOK.COM DNSSEC: unsigned URL of the ICANN WHOIS Data Problem Reporting System: http://wdprs.internic.net/ >>> Last update of WHOIS database: 2023-09-16T18:23:46Z <<<  Search results obtained from the RegistrarSafe, LLC WHOIS database are provided by RegistrarSafe, LLC for information purposes only, to assist users in obtaining information concerning a domain name registration record. The information contained therein is provided on an \"as is\" and \"as available\" basis and RegistrarSafe, LLC does not guarantee the accuracy or completeness of any information provided through the WHOIS database.  By submitting a WHOIS query, you agree to the following: (1) that you will use any information provided through the WHOIS only for lawful purposes; (2) that you will comply with all ICANN rules and regulations governing use of the WHOIS; (3)  that you will not use any information provided through the WHOIS to  enable, or otherwise cause the transmission of mass unsolicited, commercial advertising or solicitations via e-mail (i.e., spam); or (4) that you will not use the WHOIS to enable or otherwise utilize high volume, automated, electronic processes that apply to or attach to RegistrarSafe, LLC or its systems. RegistrarSafe, LLC reserves the right to modify these terms at any time and to take any other appropriate actions, including but not limited to restricting any access that violates these terms and conditions. By submitting this query, you acknowledge and agree to abide by the foregoing terms, conditions and policies.  For more information on Whois status codes, please visit     https://www.icann.org/resources/pages/epp-status-codes-2014-06-16-en. ", "spider": "whois", "url": "https://www.whois.com/whois/facebook.com", "scraping_date": "2023-09-16 15:43:16"},
{"domain_name": "amazon.com", "registered_on": "1994-11-01", "expires_on": "2024-10-30", "updated_on": "2023-05-16", "status": ["clientDeleteProhibited", "clientTransferProhibited", "clientUpdateProhibited", "serverDeleteProhibited", "serverTransferProhibited", "serverUpdateProhibited"], "servers_names": ["ns1.amzndns.co.uk", "ns1.amzndns.com", "ns1.amzndns.net", "ns1.amzndns.org", "ns2.amzndns.co.uk", "ns2.amzndns.com", "ns2.amzndns.net", "ns2.amzndns.org"], "registrant_name": "Hostmaster, Amazon Legal Dept.", "registrant_organization": "Amazon Technologies, Inc.", "registrant_street": "P.O. Box 8102", "registrant_city": "Reno", "registrant_state": "NV", "registrant_postal_code": "89507", "registrant_country": "US", "registrant_phone": "+1.2062664064", "registrant_fax": "+1.2062667010", "admin_name": "Hostmaster, Amazon Legal Dept.", "admin_organization": "Amazon Technologies, Inc.", "admin_street": "P.O. Box 8102", "admin_city": "Reno", "admin_state": "NV", "admin_postal_code": "89507", "admin_country": "US", "admin_phone": "+1.2062664064", "admin_fax": "+1.2062667010", "tech_name": "Hostmaster, Amazon Legal Dept.", "tech_organization": "Amazon Technologies, Inc.", "tech_street": "P.O. Box 8102", "tech_city": "Reno", "tech_state": "NV", "tech_postal_code": "89507", "tech_country": "US", "tech_phone": "+1.2062664064", "tech_fax": "+1.2062667010", "raw_data": "Domain Name: amazon.com Registry Domain ID: 281209_DOMAIN_COM-VRSN Registrar WHOIS Server: whois.markmonitor.com Registrar URL: http://www.markmonitor.com Updated Date: 2023-05-16T18:56:31+0000 Creation Date: 1994-11-01T05:00:00+0000 Registrar Registration Expiration Date: 2024-10-30T07:00:00+0000 Registrar: MarkMonitor, Inc. Registrar IANA ID: 292 Registrar Abuse Contact Email:  @markmonitor.com Registrar Abuse Contact Phone: +1.2086851750 Domain Status: clientUpdateProhibited (https://www.icann.org/epp#clientUpdateProhibited) Domain Status: clientTransferProhibited (https://www.icann.org/epp#clientTransferProhibited) Domain Status: clientDeleteProhibited (https://www.icann.org/epp#clientDeleteProhibited) Domain Status: serverUpdateProhibited (https://www.icann.org/epp#serverUpdateProhibited) Domain Status: serverTransferProhibited (https://www.icann.org/epp#serverTransferProhibited) Domain Status: serverDeleteProhibited (https://www.icann.org/epp#serverDeleteProhibited) Registry Registrant ID:  Registrant Name: Hostmaster, Amazon Legal Dept. Registrant Organization: Amazon Technologies, Inc. Registrant Street: P.O. Box 8102 Registrant City: Reno Registrant State/Province: NV Registrant Postal Code: 89507 Registrant Country: US Registrant Phone: +1.2062664064 Registrant Phone Ext:  Registrant Fax: +1.2062667010 Registrant Fax Ext:  Registrant Email:  @amazon.com Registry Admin ID:  Admin Name: Hostmaster, Amazon Legal Dept. Admin Organization: Amazon Technologies, Inc. Admin Street: P.O. Box 8102 Admin City: Reno Admin State/Province: NV Admin Postal Code: 89507 Admin Country: US Admin Phone: +1.2062664064 Admin Phone Ext:  Admin Fax: +1.2062667010 Admin Fax Ext:  Admin Email:  @amazon.com Registry Tech ID:  Tech Name: Hostmaster, Amazon Legal Dept. Tech Organization: Amazon Technologies, Inc. Tech Street: P.O. Box 8102 Tech City: Reno Tech State/Province: NV Tech Postal Code: 89507 Tech Country: US Tech Phone: +1.2062664064 Tech Phone Ext:  Tech Fax: +1.2062667010 Tech Fax Ext:  Tech Email:  @amazon.com Name Server: ns1.amzndns.net Name Server: ns2.amzndns.co.uk Name Server: ns1.amzndns.org Name Server: ns1.amzndns.com Name Server: ns1.amzndns.co.uk Name Server: ns2.amzndns.org Name Server: ns2.amzndns.com Name Server: ns2.amzndns.net DNSSEC: unsigned URL of the ICANN WHOIS Data Problem Reporting System: http://wdprs.internic.net/ >>> Last update of WHOIS database: 2023-09-15T09:01:18+0000 <<<  For more information on WHOIS status codes, please visit:   https://www.icann.org/resources/pages/epp-status-codes  If you wish to contact this domain’s Registrant, Administrative, or Technical contact, and such email address is not visible above, you may do so via our web form, pursuant to ICANN’s Temporary Specification. To verify that you are not a robot, please enter your email address to receive a link to a page that facilitates email communication with the relevant contact(s).  Web-based WHOIS:   https://domains.markmonitor.com/whois  If you have a legitimate interest in viewing the non-public WHOIS details, send your request and the reasons for your request to  @markmonitor.com and specify the domain name in the subject line. We will review that request and may ask for supporting documentation and explanation.  The data in MarkMonitor’s WHOIS database is provided for information purposes, and to assist persons in obtaining information about or related to a domain name’s registration record. While MarkMonitor believes the data to be accurate, the data is provided \"as is\" with no guarantee or warranties regarding its accuracy.  By submitting a WHOIS query, you agree that you will use this data only for lawful purposes and that, under no circumstances will you use this data to:   (1) allow, enable, or otherwise support the transmission by email, telephone, or facsimile of mass, unsolicited, commercial advertising, or spam; or   (2) enable high volume, automated, or electronic processes that send queries, data, or email to MarkMonitor (or its systems) or the domain name contacts (or its systems).  MarkMonitor reserves the right to modify these terms at any time.  By submitting this query, you agree to abide by this policy.  MarkMonitor Domain Management(TM) Protecting companies and consumers in a digital world.  Visit MarkMonitor at https://www.markmonitor.com Contact us at +1.8007459229 In Europe, at +44.02032062220 ---- ", "spider": "whois", "url": "https://www.whois.com/whois/amazon.com", "scraping_date": "2023-09-16 15:43:20"}
]